{
  "schemaVersion": 2,
  "contentRevision": "ws-content-r2.1",
  "domain": "support-entities",
  "records": [
    {
      "id": "ENT-PROJ-PLAYER-BOW",
      "sourceDocumentId": "ENTITY-LIST-001",
      "enabled": true,
      "kind": "PROJECTILE",
      "bukkitType": "ARROW",
      "displayFallback": "ARROW",
      "cleanupPolicy": "owner skill 종료/적중/60틱",
      "lootTableId": "LOOT-NONE",
      "ownerPolicy": "PLAYER",
      "persistent": false,
      "flags": [],
      "raw": [
        "ENT-PROJ-PLAYER-BOW",
        "PROJECTILE",
        "ARROW",
        "owner skill 종료/적중/60틱",
        "LOOT-NONE"
      ]
    },
    {
      "id": "ENT-PROJ-PLAYER-CROSSBOW",
      "sourceDocumentId": "ENTITY-LIST-001",
      "enabled": true,
      "kind": "PROJECTILE",
      "bukkitType": "ARROW",
      "displayFallback": "ARROW",
      "cleanupPolicy": "owner skill 종료/적중/60틱",
      "lootTableId": "LOOT-NONE",
      "ownerPolicy": "PLAYER",
      "persistent": false,
      "flags": [],
      "raw": [
        "ENT-PROJ-PLAYER-CROSSBOW",
        "PROJECTILE",
        "ARROW",
        "owner skill 종료/적중/60틱",
        "LOOT-NONE"
      ]
    },
    {
      "id": "ENT-PROJ-PLAYER-STAFF",
      "sourceDocumentId": "ENTITY-LIST-001",
      "enabled": true,
      "kind": "PROJECTILE",
      "bukkitType": "SNOWBALL",
      "displayFallback": "SNOWBALL+Display",
      "cleanupPolicy": "적중/40틱",
      "lootTableId": "LOOT-NONE",
      "ownerPolicy": "PLAYER",
      "persistent": false,
      "flags": [],
      "raw": [
        "ENT-PROJ-PLAYER-STAFF",
        "PROJECTILE",
        "SNOWBALL+Display",
        "적중/40틱",
        "LOOT-NONE"
      ]
    },
    {
      "id": "ENT-PROJ-PLAYER-TRIDENT",
      "sourceDocumentId": "ENTITY-LIST-001",
      "enabled": true,
      "kind": "PROJECTILE",
      "bukkitType": "TRIDENT",
      "displayFallback": "TRIDENT Display",
      "cleanupPolicy": "회수/80틱",
      "lootTableId": "LOOT-NONE",
      "ownerPolicy": "PLAYER",
      "persistent": false,
      "flags": [],
      "raw": [
        "ENT-PROJ-PLAYER-TRIDENT",
        "PROJECTILE",
        "TRIDENT Display",
        "회수/80틱",
        "LOOT-NONE"
      ]
    },
    {
      "id": "ENT-PROJ-PLAYER-RESCUE-FLARE",
      "sourceDocumentId": "ENTITY-LIST-001",
      "enabled": true,
      "kind": "PROJECTILE",
      "bukkitType": "FIREWORK_ROCKET",
      "displayFallback": "FIREWORK",
      "cleanupPolicy": "착탄/40틱",
      "lootTableId": "LOOT-NONE",
      "ownerPolicy": "PLAYER",
      "persistent": false,
      "flags": [],
      "raw": [
        "ENT-PROJ-PLAYER-RESCUE-FLARE",
        "PROJECTILE",
        "FIREWORK",
        "착탄/40틱",
        "LOOT-NONE"
      ]
    },
    {
      "id": "ENT-DEPLOY-EMERGENCY-COVER",
      "sourceDocumentId": "ENTITY-LIST-001",
      "enabled": true,
      "kind": "DEPLOYABLE",
      "bukkitType": "BLOCK_DISPLAY",
      "displayFallback": "BLOCK_DISPLAY",
      "cleanupPolicy": "HP0/12초/전투 종료",
      "lootTableId": "LOOT-NONE",
      "ownerPolicy": "SYSTEM",
      "persistent": false,
      "flags": [],
      "raw": [
        "ENT-DEPLOY-EMERGENCY-COVER",
        "DEPLOYABLE",
        "BLOCK_DISPLAY",
        "HP0/12초/전투 종료",
        "LOOT-NONE"
      ]
    },
    {
      "id": "ENT-UI-DAMAGE-NUMBER",
      "sourceDocumentId": "ENTITY-LIST-001",
      "enabled": true,
      "kind": "UI_TRANSIENT",
      "bukkitType": "TEXT_DISPLAY",
      "displayFallback": "TEXT_DISPLAY",
      "cleanupPolicy": "12~18틱",
      "lootTableId": "LOOT-NONE",
      "ownerPolicy": "SYSTEM",
      "persistent": false,
      "flags": [],
      "raw": [
        "ENT-UI-DAMAGE-NUMBER",
        "UI_TRANSIENT",
        "TEXT_DISPLAY",
        "12~18틱",
        "LOOT-NONE"
      ]
    },
    {
      "id": "ENT-D18-SILENT-FOLLOWER",
      "sourceDocumentId": "ENTITY-LIST-001",
      "enabled": true,
      "kind": "SUMMON",
      "bukkitType": "INTERACTION",
      "displayFallback": "SILVERFISH+Display",
      "cleanupPolicy": "소유 행동·정예 사망/전투 종료",
      "lootTableId": "LOOT-NONE",
      "ownerPolicy": "SYSTEM",
      "persistent": false,
      "flags": [
        "NO_REWARD",
        "NO_SAMPLE",
        "NO_AUGMENT_TRIGGER",
        "NO_CONTRIBUTION",
        "NO_COLLISION",
        "CHORUS_VISUALIZER"
      ],
      "raw": [
        "ENT-D18-SILENT-FOLLOWER",
        "SUMMON",
        "SILVERFISH+Display",
        "소유 행동·정예 사망/전투 종료",
        "LOOT-NONE"
      ]
    },
    {
      "id": "ENT-NODE-BASIC",
      "sourceDocumentId": "ENTITY-LIST-001",
      "enabled": true,
      "kind": "RESOURCE_NODE",
      "bukkitType": "BLOCK_DISPLAY",
      "displayFallback": "INTERACTION+BLOCK_DISPLAY",
      "cleanupPolicy": "채집/Day despawn",
      "lootTableId": "LOOT-NODE-BASIC",
      "ownerPolicy": "SYSTEM",
      "persistent": false,
      "flags": [],
      "raw": [
        "ENT-NODE-BASIC",
        "RESOURCE_NODE",
        "INTERACTION+BLOCK_DISPLAY",
        "채집/Day despawn",
        "LOOT-NODE-BASIC"
      ]
    },
    {
      "id": "ENT-NODE-INDUSTRIAL",
      "sourceDocumentId": "ENTITY-LIST-001",
      "enabled": true,
      "kind": "RESOURCE_NODE",
      "bukkitType": "BLOCK_DISPLAY",
      "displayFallback": "INTERACTION+BLOCK_DISPLAY",
      "cleanupPolicy": "채집/Day despawn",
      "lootTableId": "LOOT-NODE-INDUSTRIAL",
      "ownerPolicy": "SYSTEM",
      "persistent": false,
      "flags": [],
      "raw": [
        "ENT-NODE-INDUSTRIAL",
        "RESOURCE_NODE",
        "INTERACTION+BLOCK_DISPLAY",
        "채집/Day despawn",
        "LOOT-NODE-INDUSTRIAL"
      ]
    },
    {
      "id": "ENT-NODE-MEDICAL",
      "sourceDocumentId": "ENTITY-LIST-001",
      "enabled": true,
      "kind": "RESOURCE_NODE",
      "bukkitType": "INTERACTION",
      "displayFallback": "INTERACTION+ITEM_DISPLAY",
      "cleanupPolicy": "채집/Day despawn",
      "lootTableId": "LOOT-NODE-MEDICAL",
      "ownerPolicy": "SYSTEM",
      "persistent": false,
      "flags": [],
      "raw": [
        "ENT-NODE-MEDICAL",
        "RESOURCE_NODE",
        "INTERACTION+ITEM_DISPLAY",
        "채집/Day despawn",
        "LOOT-NODE-MEDICAL"
      ]
    },
    {
      "id": "ENT-NODE-CORRUPTED",
      "sourceDocumentId": "ENTITY-LIST-001",
      "enabled": true,
      "kind": "RESOURCE_NODE",
      "bukkitType": "BLOCK_DISPLAY",
      "displayFallback": "INTERACTION+BLOCK_DISPLAY",
      "cleanupPolicy": "채집/정화/Day despawn",
      "lootTableId": "LOOT-NODE-CORRUPTED",
      "ownerPolicy": "SYSTEM",
      "persistent": false,
      "flags": [],
      "raw": [
        "ENT-NODE-CORRUPTED",
        "RESOURCE_NODE",
        "INTERACTION+BLOCK_DISPLAY",
        "채집/정화/Day despawn",
        "LOOT-NODE-CORRUPTED"
      ]
    },
    {
      "id": "ENT-NODE-RIFT",
      "sourceDocumentId": "ENTITY-LIST-001",
      "enabled": true,
      "kind": "RESOURCE_NODE",
      "bukkitType": "BLOCK_DISPLAY",
      "displayFallback": "INTERACTION+BLOCK_DISPLAY",
      "cleanupPolicy": "안정화/사건 종료",
      "lootTableId": "LOOT-NODE-RIFT",
      "ownerPolicy": "SYSTEM",
      "persistent": false,
      "flags": [],
      "raw": [
        "ENT-NODE-RIFT",
        "RESOURCE_NODE",
        "INTERACTION+BLOCK_DISPLAY",
        "안정화/사건 종료",
        "LOOT-NODE-RIFT"
      ]
    },
    {
      "id": "ENT-NODE-RECONSTRUCTION",
      "sourceDocumentId": "ENTITY-LIST-001",
      "enabled": true,
      "kind": "RESOURCE_NODE",
      "bukkitType": "INTERACTION",
      "displayFallback": "INTERACTION+ITEM_DISPLAY",
      "cleanupPolicy": "채집/회차 보존",
      "lootTableId": "LOOT-NODE-RECONSTRUCTION",
      "ownerPolicy": "SYSTEM",
      "persistent": true,
      "flags": [],
      "raw": [
        "ENT-NODE-RECONSTRUCTION",
        "RESOURCE_NODE",
        "INTERACTION+ITEM_DISPLAY",
        "채집/회차 보존",
        "LOOT-NODE-RECONSTRUCTION"
      ]
    },
    {
      "id": "ENT-B10-ECHO",
      "sourceDocumentId": "ENTITY-LIST-001",
      "enabled": true,
      "kind": "SUMMON",
      "bukkitType": "ZOMBIE",
      "displayFallback": "ZOMBIE/SKELETON+Display",
      "cleanupPolicy": "BOSS-D10/페이즈 종료",
      "lootTableId": "LOOT-NONE",
      "ownerPolicy": "PARENT",
      "persistent": false,
      "flags": [],
      "raw": [
        "ENT-B10-ECHO",
        "SUMMON",
        "ZOMBIE/SKELETON+Display",
        "BOSS-D10/페이즈 종료",
        "LOOT-NONE"
      ]
    },
    {
      "id": "ENT-B10-CORE",
      "sourceDocumentId": "ENTITY-LIST-001",
      "enabled": true,
      "kind": "OBJECTIVE",
      "bukkitType": "BLOCK_DISPLAY",
      "displayFallback": "INTERACTION+BLOCK_DISPLAY",
      "cleanupPolicy": "패턴 종료",
      "lootTableId": "LOOT-NONE",
      "ownerPolicy": "PARENT",
      "persistent": false,
      "flags": [],
      "raw": [
        "ENT-B10-CORE",
        "OBJECTIVE",
        "INTERACTION+BLOCK_DISPLAY",
        "패턴 종료",
        "LOOT-NONE"
      ]
    },
    {
      "id": "ENT-B10-SHARD",
      "sourceDocumentId": "ENTITY-LIST-001",
      "enabled": true,
      "kind": "PROJECTILE",
      "bukkitType": "SNOWBALL",
      "displayFallback": "SNOWBALL+Display",
      "cleanupPolicy": "적중/40틱",
      "lootTableId": "LOOT-NONE",
      "ownerPolicy": "PARENT",
      "persistent": false,
      "flags": [],
      "raw": [
        "ENT-B10-SHARD",
        "PROJECTILE",
        "SNOWBALL+Display",
        "적중/40틱",
        "LOOT-NONE"
      ]
    },
    {
      "id": "ENT-B10-SIPHON-LINK",
      "sourceDocumentId": "ENTITY-LIST-001",
      "enabled": true,
      "kind": "TELEGRAPH",
      "bukkitType": "TEXT_DISPLAY",
      "displayFallback": "TEXT_DISPLAY+PARTICLE",
      "cleanupPolicy": "패턴 종료",
      "lootTableId": "LOOT-NONE",
      "ownerPolicy": "PARENT",
      "persistent": false,
      "flags": [],
      "raw": [
        "ENT-B10-SIPHON-LINK",
        "TELEGRAPH",
        "TEXT_DISPLAY+PARTICLE",
        "패턴 종료",
        "LOOT-NONE"
      ]
    },
    {
      "id": "ENT-B20-LINK-CORE",
      "sourceDocumentId": "ENTITY-LIST-001",
      "enabled": true,
      "kind": "OBJECTIVE",